{
  "administrationId": "adm-1",
  "orgId": "org-demo",
  "pseudonymId": "p-7f3a",
  "contextId": "ctx-2026q3",
  "instrumentId": "who-5",
  "instrumentCitation": "Topp CW et al. The WHO-5 Well-Being Index: a systematic review of the literature. Psychother Psychosom 2015;84:167-176.",
  "instrumentVersion": "1998",
  "occasionTs": "2026-08-12T09:20:00+01:00",
  "constructCodes": [
    "mental-health"
  ],
  "completionStatus": "complete",
  "totalScore": 68,
  "band": "moderate",
  "aboveThresholdFlag": false
}
